{
  "$schema": "https://json-schema.org/draft/2020-12/schema",
  "$id": "https://economic-prophet.dev/schemas/uvmc_measurement_context.schema.json",
  "title": "UVMC Measurement Context",
  "description": "Context envelope binding measured objects to period, scenario, industry overlay, model, parameters, formula version, and dimensional coordinates.",
  "type": "object",
  "required": [
    "measurement_context_id",
    "object_id",
    "object_type",
    "as_of",
    "period_id",
    "horizon",
    "scenario_id",
    "model_version",
    "parameter_set",
    "formula_version",
    "cadence",
    "source_system",
    "lineage"
  ],
  "properties": {
    "measurement_context_id": {"type": "string", "minLength": 1},
    "object_id": {"type": "string", "minLength": 1},
    "object_type": {
      "type": "string",
      "enum": [
        "legal_entity",
        "line_of_business",
        "portfolio",
        "relationship",
        "account",
        "instrument",
        "transaction_event",
        "collateral_set",
        "funding_source",
        "hedge_set",
        "sphere",
        "edge",
        "triparty_face",
        "other"
      ]
    },
    "as_of": {"type": "string"},
    "period_id": {"type": "string", "minLength": 1},
    "horizon": {"type": "string", "minLength": 1},
    "scenario_id": {"type": "string", "minLength": 1},
    "industry_overlay_id": {"type": "string"},
    "currency": {"type": "string"},
    "cadence": {"type": "string", "enum": ["event_time", "streaming", "intraday", "daily", "monthly", "quarterly", "annual", "close_cycle"]},
    "source_system": {"type": "string", "minLength": 1},
    "source_record_id": {"type": "string"},
    "model_version": {"type": "string", "minLength": 1},
    "parameter_set": {"type": "string", "minLength": 1},
    "formula_version": {"type": "string", "minLength": 1},
    "dimension_coordinates": {
      "type": "object",
      "additionalProperties": {"type": ["string", "number", "boolean"]}
    },
    "lineage": {
      "type": "object",
      "required": ["parent_chain", "type_chain"],
      "properties": {
        "parent_chain": {"type": "array", "items": {"type": "string"}},
        "type_chain": {"type": "array", "items": {"type": "string"}},
        "input_hash": {"type": "string"},
        "output_hash": {"type": "string"}
      },
      "additionalProperties": false
    },
    "owner": {"type": "string"},
    "status": {"type": "string", "enum": ["draft", "active", "inactive", "pending", "deprecated"]}
  },
  "additionalProperties": false
}
